"","SCHOOL","PROGRAM","DEGREE","ONLINE","ONCAMPUS","COUNTRY","STATE","CITY","DEPARTMENT","URL","skills"
"92","Florida International University","Master of Science in Health Informatics and Management Systems","M",FALSE,TRUE,"US","FL","Miami","Chapman Graduate School of Business","http://business.fiu.edu/fiubusiness/mshims.cfm","leadership, social"
"93","Florida Polytechnic University","Big Data Analytics","B",FALSE,TRUE,"US","FL","Lakeland","College of Innovation & Technology","https://floridapolytechnic.org/academics/advanced-technology/big-data-analytics/","communication, experience, leadership, management, research, social"
"94","Full Sail University","Master of Science in Business Intelligence","M",TRUE,FALSE,"US","FL","Winter Park","Full Sail University","http://www.fullsail.edu/degrees/online/business-intelligence-masters","communication, competitive, experience, leadership, management, presentation, social"
"95","Nova Southeastern University","Master of Science in Biomedical Informatics","M",TRUE,TRUE,"US","FL","Fort Lauderdale","College of Osteopathic Medicine","http://medicine.nova.edu/msbi/curriculum.html","communication, competitive, conflict management, decision making, dedicated, experience, independent, inspiring, interpersonal, knowledge management, leadership, management, negotiation, organization, planning, presentation, problem solving, process improvement, research, scheduling, self-awareness, self-directed, social, strategic planning, team building, time management, training"
"96","Nova Southeastern University","Graduate Certificate in Business Intelligence / Analytics","C",TRUE,FALSE,"US","FL","Fort Lauderdale","Graduate School of Computer and Information Sciences","http://www.scis.nova.edu/masters/certificate_bi.html","communication, experience, leadership, research, social"
"97","Pasco-Hernando State College","Healthcare Informatics Specialist Certificate","C",TRUE,FALSE,"US","FL","New Port Richey","Health and Information Technology","http://phsc.edu/program/healthcare-informatics-specialist-certificate",""
"98","University of Central Florida","M.S.  in Statistical Computing Data Mining Track","M",FALSE,TRUE,"US","FL","Orlando","Department of Statistics","http://dms.stat.ucf.edu/","inspiring, research"
"99","University of Central Florida","Master of Science in Health Care Informatics","M",FALSE,TRUE,"US","FL","Orlando","Department of Health Management & Informatics","http://www.ce.ucf.edu/Program/2626/Master-Of-Science-In-Health-Care-Informatics/","management, research, social"
"100","University of Central Florida","Professional Science Master's Program in Health Care Informatics","M",FALSE,TRUE,"US","FL","Orlando","Department of Health Management and Informatics","http://www.graduatecatalog.ucf.edu/programs/Program.aspx?ID=5852","competitive, experience, management, planning, research, social"
"101","University of Florida","Master of Science in Information Systems and Operations Management (Business Intelligence & Analytics specialization)","M",FALSE,TRUE,"US","FL","Gainesville","Warrington College of Business Administration","http://warrington.ufl.edu/graduate/academics/ms-isom/","experience, leadership, management, organization, research, social"
"102","University of Miami","Master of Science in Business Analytics","M",FALSE,TRUE,"US","FL","Coral Gables","University of Miami School of Business","http://www.bus.miami.edu/graduate-programs/specialized-masters/analytics/index.html","competitive, experience, innovator, leadership, management, organization, research, social"
"103","University of South Florida Sarasota-Manatee","Business Analytics Certificate","C",TRUE,FALSE,"US","FL","Sarasota","College of Business","http://usfsm.edu/catalog/graduate/college-of-business-degree-programs/college-of-business-certificate-programs/business-analytics-certificate/","communication, competitive, confident, independent, leadership, management, organization, research, social"
"104","University of South Florida-Main Campus","Analytics and Business Intelligence Certificate","C",TRUE,FALSE,"US","FL","Tampa","Muma College of Business","http://www.usf.edu/innovative-education/programs/graduate-certificates/analytics-and-business-intelligence.aspx","experience, management, research, social"
"105","University of South Florida-Main Campus","MS in Health Informatics Online","M",FALSE,TRUE,"US","FL","Tampa","Morsani College of Medicine","http://www.usfhealthonline.com/programs/masters-degree/ms-health-informatics/","competitive, decision making, experience, management, organization, research, social, training"
"106","Georgia Southern University","M.S. - Computer Science with concentration in Data and Knowledge Systems","M",TRUE,FALSE,"US","GA","Statesboro","Department of Computer Sciences","http://ceit.georgiasouthern.edu/cs/degrees/mscs/","experience, flexible, leadership, organization, research, social"
"107","Georgia State University","Master of Science in Analytics","M",FALSE,TRUE,"US","GA","Atlanta","Robinson College of Business","http://specialized.robinson.gsu.edu/msa/","communication, confident, experience, friendly, leadership, management, organization, planning, research, social, training"
"108","Georgia Tech","MS in Analytics","M",TRUE,TRUE,"US","GA","Atlanta","Colleges of Business, Computing, and Engineering","http://www.analytics.gatech.edu/","dedicated, leadership, management, organization, research, social"
"109","Georgia Tech","MS - Computer Science with specialization in machine learning","M",FALSE,TRUE,"US","GA","Atlanta","College of Computing","http://www.cc.gatech.edu/future/masters/mscs/program","communication, mentoring, organization, research, social"
"110","Kennesaw State University","Analytics and Data Science","D",FALSE,TRUE,"US","GA","Kennesaw","Department of Statistics and Analytical Sciences","https://datascience.kennesaw.edu/","communication, decision making, research, social"
"111","Kennesaw State University","Online Certificate in Applied Statistics","C",TRUE,FALSE,"US","GA","Kennesaw","Department of Statistics and Analytical Sciences","https://analytics.kennesaw.edu/academics/certificate/appl-stat/index.html","research, social"
"112","Kennesaw State University","Master of Science in Applied Statistics","M",FALSE,TRUE,"US","GA","Kennesaw","Department of Mathematics and Statistics","https://analytics.kennesaw.edu/academics/grad/MSAS/index.html","research, social"
"113","Mercer University","M.S. In Business Analytics","M",FALSE,TRUE,"US","GA","Macon","Stetson School of Business and Economics","http://business.mercer.edu/business-analytics/",""
"114","University of Georgia","MBA with concentration in Business Analytics","M",TRUE,TRUE,"US","GA","Athens","Terry College of Business","http://www.terry.uga.edu/mba/fulltime/concentrations/business-analytics","decision making, leadership, management, organization, social"
"115","Loras College","MBA - Business Analytics","M",TRUE,FALSE,"US","IA","Dubuque","Loras College","http://www.loras.edu/Academics/MBA-Business-Analytics.aspx",""
"116","Northwestern College","Analytics Certificate","C",FALSE,TRUE,"US","IA","Orange City","Adult and Graduate Studies","http://online.nwciowa.edu/analytics",""
"117","Luther College","Data Science","B",FALSE,TRUE,"US","IA","Decorah","Computer Science","https://www.luther.edu/computer-science/data-science-major/","communication, experience, leadership, research, social, training"
"118","The University of Iowa","Business Analytics","B",FALSE,TRUE,"US","IA","Iowa City","Business","http://tippie.uiowa.edu/management-sciences/undergraduate.cfm","communication, cooperative, experience, management, organization, presentation, process improvement, research, social"
"119","The University of Iowa","Business Analytics Certificate Program","C",FALSE,TRUE,"US","IA","Cedar Rapids","Business","http://tippie.uiowa.edu/business-analytics","communication, cooperative, decision making, experience, management, organization, research, social"
"120","The University of Iowa","Business Analytics Graduate Program","M",FALSE,TRUE,"US","IA","Cedar Rapids","Business","http://tippie.uiowa.edu/business-analytics","communication, cooperative, decision making, experience, management, organization, research, social"
"121","Aurora University","Master of Science in Digital Marketing and Analytics","M",FALSE,TRUE,"US","IL","Aurora","Dunham School of Business","http://www.aurora.edu/academics/graduate/marketing/index.html","competitive, confident, leadership, management, research, social"
"122","Benedictine University","Master of Science in Business Analytics","M",FALSE,TRUE,"US","IL","Lisle","College of Business","http://www.ben.edu/college-of-business/graduate/master-of-science-in-business-analytics.cfm","competitive, dedicated, experience, leadership, management, organization, planning, research, social"
"123","DePaul University","M.S. in Predictive Analytics","M",FALSE,TRUE,"US","IL","Chicago","College of Computing and Digital Media","http://www.cdm.depaul.edu/academics/Pages/MS-In-Predictive-Analytics.aspx","communication, confident, decision making, experience, management, organization, planning, research, social"
"124","DePaul University","Information Systems (MS) - Business Intelligence Concentration","M",TRUE,FALSE,"US","IL","Chicago","College of Computing and Digital Media","http://www.depaul.edu/university-catalog/degree-requirements/graduate/cdm/information-systems-ms/concentrations/Pages/business-intelligence.aspx","communication, confident, management"
"125","Elmhurst College","M.S. in Data Science","M",FALSE,TRUE,"US","IL","Elmhurst","Elmhurst College Online Center","http://public.elmhurst.edu/data_science","decision making, experience, organization, research, social"
"126","Elmhurst College","Graduate Certificate in Data Science","C",FALSE,TRUE,"US","IL","Elmhurst","Elmhurst College Online Center","http://public.elmhurst.edu/data_science/227880201.html","social"
"127","Illinois Institute of Technology","MS - CS specialization in Data Analytics (with co-terminal BS/MS option)","M",TRUE,FALSE,"US","IL","Chicago","College of Science","http://science.iit.edu/programs/graduate/master-computer-science-specialization-data-analytics","communication, flexible, leadership, research, social"
"128","Illinois Institute of Technology","Master of Data Science","M",TRUE,TRUE,"US","IL","Chicago","College of Science","http://science.iit.edu/programs/graduate/master-data-science","assertive, communication, flexible, leadership, research, social"
"129","Illinois Institute of Technology","Data Analytics","M",FALSE,TRUE,"US","IL","Chicago","Computer Science","http://science.iit.edu/programs/graduate/master-computer-science-specialization-data-analytics","communication, flexible, leadership, research, social"
"130","Lewis University","Data Science","M",TRUE,TRUE,"US","IL","Romeoville","Computer Science","http://www.lewisu.edu/academics/data-science/index.htm","experience, flexible, leadership, organization, planning, research, social"
"131","Lewis University","Business Analytics, M.S.","M",TRUE,FALSE,"US","IL","Romeoville","College of Business","https://www.lewisu.edu/academics/business-analytics/index.htm","decision making, experience, flexible, leadership, management, organization, planning, research, social"
"132","Loyola University Chicago","M.S. in Applied Statistics","M",FALSE,TRUE,"US","IL","Chicago","Mathematics and Statistics","http://www.luc.edu/math/msappliedstat.shtml","communication, decision making, experience, organization, research, social"
"133","Loyola University Chicago","Graduate Certificate in Business Intelligence and Data Warehousing","C",FALSE,TRUE,"US","IL","Chicago","Quinlan School of Business","http://www.luc.edu/quinlan/mba/academics/certificates-data-warehousing/",""
"134","Northwestern University","Certificate in Analytics and Business Intelligence for IT Professionals","C",TRUE,TRUE,"US","IL","Evanston","School of Professional Studies","http://sps.northwestern.edu/program-areas/advanced-graduate/analytics-business-intelligence/index.php","communication, customer service, experience, highly recommended, leadership, management, organization, social, training"
"135","Northwestern University","Master of Science in Information Systems with Concentration in Analytics and Business Intelligence","M",FALSE,TRUE,"US","IL","Evanston","School of Professional Studies","http://sps.northwestern.edu/program-areas/graduate/information-systems/index.php","communication, competitive, conflict resolution, experience, highly recommended, independent, knowledge management, leadership, management, organization, planning, research, social, strategic planning, training"
"136","Northwestern University","Certificate in Predictive Business Analytics","C",FALSE,TRUE,"US","IL","Evanston","Bridge School of Management","http://sps.northwestern.edu/program-areas/professional-development/bridge-school/index.php",""
"137","Northwestern University","Master of Science in Analytics","M",FALSE,TRUE,"US","IL","Evanston","McCormick School of Engineering","http://www.analytics.northwestern.edu/","competitive, experience, independent, leadership, management, organization, research, social"
"138","Northwestern University","Master of Science in Predictive Analytics Online","M",TRUE,FALSE,"US","IL","Evanston","School of Continuing Studies","http://sps.northwestern.edu/program-areas/graduate/predictive-analytics/index.php","communication, competitive, customer service, dedicated, experience, independent, leadership, management, negotiation, organization, presentation, problem solving, research, scheduling, social, training"
"139","University of Chicago","Master of Science in Computational Analysis & Public Policy (CAPP)","M",FALSE,TRUE,"US","IL","Chicago","Harris School of Public Policy & Computer Science Department","http://capp.sites.uchicago.edu/","experience, organization, research, social"
"140","University of Chicago","Master of Science in Analytics","M",FALSE,TRUE,"US","IL","Chicago","Graham School of Continuing Liberal and Professional Studies","http://grahamschool.uchicago.edu/credit/master-science-analytics/index","communication, experience, flexible, leadership, research, social, training"
"141","University of Illinois at Chicago","Health Informatics (IBHE-Approved Certificate)","C",TRUE,FALSE,"US","IL","Chicago","College of Applied Health Sciences","http://catalog.uic.edu/gcat/colleges-schools/applied-health-sciences/him-cert/","communication, confident, cooperative, decision making, experience, independent, knowledge management, leadership, management, motivated, organization, planning, presentation, research, social"
"142","University of Illinois at Chicago","Master of Science in Health Informatics Research Track","M",TRUE,FALSE,"US","IL","Chicago","Department of Biomedical and Health Information Sciences","http://healthinformatics.uic.edu/","communication, decision making, experience, independent, knowledge management, leadership, management, organization, planning, research, social, strategic planning, training"
"143","University of Illinois at Springfield","Graduate Certificate in Business Intelligence","C",FALSE,TRUE,"US","IL","Springfield","Department of Management Information Systems","http://mis.uis.edu/BIcertificate.html","management, organization, research"
"144","University of Illinois at Urbana-Champaign","Master of Science in Statistics: Analytics Concentration","M",FALSE,TRUE,"US","IL","Champaign","Department of Statistics","http://www.stat.illinois.edu/degrees/msanalytics.shtml",""
"145","University of Illinois at Urbana-Champaign","Master of Computer Science in Data Science","M",TRUE,FALSE,"US","IL","Champaign","Department of Computer Science","https://online.illinois.edu/mcs-ds","management, research, social"
"146","University of St Francis","Graduate Certificate in Business Analytics","C",FALSE,TRUE,"US","IL","Joliet","College of Business and Health Administration","http://www.stfrancis.edu/academics/college-of-business/graduate-certificate-business-analytics/",""
"147","University of St Francis","MBA with a concentration in Business Analytics","M",TRUE,FALSE,"US","IL","Joliet","College of Business and Health Administration","http://www.stfrancis.edu/academics/master-of-business-administration/#.VCQeLEu0Zg0","competitive, decision making, experience, flexible, leadership, management, organization, presentation, social, training"
"148","Indiana University Bloomington","MBA (Major in Business Analytics)","M",TRUE,FALSE,"US","IN","Bloomington","Kelley School of Business","http://kelley.iu.edu/mba/academics/MajorsMinors/page38907.html","experience, leadership, management, organization, research, social"
"149","Indiana University Bloomington","Online MS in Business Analytics","M",FALSE,TRUE,"US","IN","Bloomington","Kelley School of Business","http://kelley.iu.edu/onlineMBA/Online/MSBA/page43444.cfm","communication, competitive, decision making, experience, leadership, management, organization, planning, presentation, research, scheduling, social, strategic planning"
"150","Indiana University Bloomington","Business Analytics Certificate Program","C",FALSE,TRUE,"US","IN","Bloomington","Kelley School of Business: Department of Operations and Decision Technologi","http://www.kelley.iu.edu/ODT/AboutUs/DecisionSciences/page11147.html","decision making, experience, management, organization, planning, research, scheduling, social"
"151","Indiana University Bloomington","Master of Science in Data Science","M",FALSE,TRUE,"US","IN","Bloomington","School of Informatics and Computing","http://www.soic.indiana.edu/graduate/degrees/data-science/ms-data-science/index.html","experience, organization, research, social"
"152","Indiana University Bloomington","Online Certificate in Data Science (Graduate)","C",FALSE,TRUE,"US","IN","Bloomington","School of Informatics and Computing","http://www.soic.indiana.edu/graduate/programs/data-science/index.shtml","competitive, organization, research, social"
"153","Indiana University Bloomington","Informatics","D",FALSE,TRUE,"US","IN","Bloomington","School of Informatics","http://www.soic.indiana.edu/graduate/degrees/informatics/index.html","organization, research, social"
"154","Indiana University-Purdue University-Indianapolis","M.S. in Mathematics: Applied Statistics","M",TRUE,FALSE,"US","IN","Indianapolis","Department of Mathematical Sciences","http://math.iupui.edu/graduate/degrees/ms/stats",""
"155","Indiana University-Purdue University-Indianapolis","Master of Science in Bioinformatics","M",TRUE,FALSE,"US","IN","Indianapolis","Department of BioHealth Informatics","http://soic.iupui.edu/biohealth/graduate/bioinformatics-masters/","experience, research"
"156","Purdue University-Main Campus","MBA, Specialization in Business Analytics","M",FALSE,TRUE,"US","IN","West Lafayette","Krannert School of Management","http://www.krannert.purdue.edu/masters/programs/mba/option-areas/business-analytics/home.asp","communication, experience, leadership, management, organization, research, social"
"157","Purdue University-Main Campus","Certificate in Applied Statistics","C",FALSE,TRUE,"US","IN","West Lafayette","Department of Statistics","https://engineering.purdue.edu/ProEd/credit/applied_statistics","assertive, leadership, management, planning"
"158","Saint Mary's College","Master of Science in Data Science","M",TRUE,TRUE,"US","IN","Notre Dame","Department of Mathematics and Computer Science","https://grad.saintmarys.edu/academic-programs/ms-data-science","communication, dedicated, experience, leadership, management, organization, research, social"
"159","University of Notre Dame","Master of Science in Applied and Computational Mathematics and Statistics with a specialty in Applied Statistics","M",FALSE,TRUE,"US","IN","Notre Dame","Department of Applied and Computational Mathematics and Statistics (ACMS)","http://acms.nd.edu/graduate-programs/professional-master-s-programs/master-of-science-in-applied-statistics/","research"
"160","University of Notre Dame","Master of Science in Business Analytics","M",TRUE,FALSE,"US","IN","Notre Dame","Mendoza College of Business","https://mendoza.nd.edu/programs/specialized-masters/ms-in-business-analytics/","communication, confident, experience, leadership, management, organization, research, social"
"161","University of Notre Dame","Master of Science in Data Science","M",TRUE,FALSE,"US","IN","Notre Dame","Applied and Computational Mathematics and Statistics","http://datascience.nd.edu/","communication, dedicated, experience, management, organization, research, social"
"162","University of Evansville","Statistics and Data Science","B",FALSE,TRUE,"US","IN","Evansville","Mathematics","https://www.evansville.edu/majors/math/datascience.cfm","decision making, experience, organization, research, social"
"163","Valparaiso University","Bachelors of Science in Data Science","B",FALSE,TRUE,"US","IN","Valparaiso","Interdisciplinary","http://www.valpo.edu/mathematics-statistics/academics/degree-programs/b-s-in-data-science/","experience, friendly, research, social"
"164","Valparaiso University","Bachelors of Arts in Business Analytics","B",FALSE,TRUE,"US","IN","Valparaiso","College of Business","http://www.valpo.edu/college-of-business/academics/major-programs/business-analytics/","experience, friendly, leadership, management, social"
"165","Valparaiso University","Masters of Science in Analytics and Modeling","M",FALSE,TRUE,"US","IN","Valparaiso","Graduate School","http://www.valpo.edu/analytics-modeling","experience, friendly, research, social"
"166","University of Kansas","Business Analytics","C",FALSE,TRUE,"US","KS","Lawrence","School of Business","http://business.ku.edu/business-analytics",""
"167","Northern Kentucky University","Data Science","B",FALSE,TRUE,"US","KY","Highland Heights","Computer Science","http://informatics.nku.edu/content/informatics/departments/computer-science/programs/datascience.html","communication, innovator, organization, presentation, research, social"
"168","University of Louisville","Certificate in Data Mining","C",FALSE,TRUE,"US","KY","Louisville","Department of Computer Engineering & Computer Science","http://louisville.edu/speed/computer/graduate-studies/dataMining","organization, presentation, research, social"
"169","Louisiana State University","Master of Science in Analytics","M",FALSE,TRUE,"US","LA","Baton Rouge","Department of Information Systems & Decision Sciences","http://businessanalytics.lsu.edu/","confident, experience, management, organization, research"
"170","Babson College","MBA with Business Analytics Concentration","M",FALSE,TRUE,"US","MA","Wellesley","F.W. Olin Graduate School of Business","http://www.babson.edu/academics/graduate/mba/concentrations/pages/business-analytics.aspx","confident, decision making, experience, independent, innovator, leadership, management, organization, planning, research, social"
"171","Becker College","Data Science","B",FALSE,TRUE,"US","MA","Worcester","Data Science","http://www.becker.edu/academics/departments-programs/data-science/","communication, experience, friendly, management, organization, research, social"
"172","Bentley University","Master of Science In Marketing Analytics","M",FALSE,TRUE,"US","MA","Waltham","Graduate School of Business","http://www.bentley.edu/graduate/academics/ms-programs/marketing-analytics","communication, customer service, experience, management, organization, planning, presentation, research, social"
"173","Bentley University","Master of Business Analytics","M",FALSE,TRUE,"US","MA","Waltham","Graduate School of Business","http://www.bentley.edu/graduate/degree-programs/ms-programs/business-analytics","communication, competitive, decision making, experience, leadership, management, organization, performance management, planning, presentation, research, scheduling, social"
"174","Bentley University","Graduate Certificate in Business Analytics","C",FALSE,TRUE,"US","MA","Waltham","Graduate School of Business","http://www.bentley.edu/graduate/special-programs/graduate-certificate-programs","competitive, experience, leadership, management, motivated, planning, research, social, training"
"175","Brandeis University","Master of Arts in Computational Linguistics","M",FALSE,TRUE,"US","MA","Waltham","Mitchom School of Computer Science","http://www.brandeis.edu/gsas/programs/comp_ling.html","communication, experience, research, social"
"176","Brandeis University","M.S. in Strategic Analytics","M",FALSE,TRUE,"US","MA","Waltham","Graduate Professional Studies","https://www.brandeis.edu/gps/future-students/learn-about-our-programs/strategic-analytics.html","competitive, dedicated, experience, leadership, management, motivated, organization, research, social"
"177","Harvard University","Data Science Certificate","C",TRUE,FALSE,"US","MA","Cambridge","Extension School","http://www.extension.harvard.edu/professional-certificates/data-science-certificate","communication, management, social"
"178","Harvard University","Master of Science in Computational Biology and Quantitative Genetics","M",FALSE,TRUE,"US","MA","Cambridge","School of Public Health","http://www.hsph.harvard.edu/sm-computational-biology/","experience, organization, research, social, training"
"179","Harvard University","Master of Science in Computational Science and Engineering","M",FALSE,TRUE,"US","MA","Cambridge","School of Engineering and Applied Sciences","http://www.seas.harvard.edu/computational-science-and-engineering/master-science-cse","independent, leadership, reliable, research, training"
